title,spoken_languages,production_countries,vote_average,release_date,runtime,overview,Adventure,Action,Science Fiction,Animation,Family,Comedy,Drama,Romance,Mystery,Crime,Horror,Thriller,Fantasy,Documentary,War,Music,Western,History,TV Movie
A Close Shave,['English'],['United Kingdom'],7.5,1995-04-10,30,"Wallace's whirlwind romance with the proprietor of the local wool shop puts his head in a spin, and Gromit is framed for sheep-rustling in a fiendish criminal plot.",0.0,0.0,0.0,1.0,1.0,1.0,0.0,0.0,0.0,0.0,0.0,0.0,0.0,0.0,0.0,0.0,0.0,0.0,0.0
Wallace & Gromit: The Curse of the Were-Rabbit,['English'],"['United Kingdom', 'United States of America']",7.0,2005-09-04,85,"Cheese-loving eccentric Wallace and his cunning canine pal, Gromit, investigate a mystery in Nick Park's animated adventure, in which the lovable inventor and his intrepid pup run a business ridding the town of garden pests. Using only humane methods that turn their home into a halfway house for evicted vermin, the pair stumble upon a mystery involving a voracious vegetarian monster that threatens to ruin the annual veggie-growing contest.",1.0,0.0,0.0,1.0,1.0,1.0,0.0,0.0,0.0,0.0,0.0,0.0,0.0,0.0,0.0,0.0,0.0,0.0,0.0
Terminator Salvation,"['English', 'Italian']","['Germany', 'Italy', 'United Kingdom', 'United States of America']",6.0,2009-05-20,117,"All grown up in post-apocalyptic 2018, John Connor must lead the resistance of humans against the increasingly dominating militaristic robots. But when Marcus Wright appears, his existence confuses the mission as Connor tries to determine whether Wright has come from the future or the past -- and whether he's friend or foe.",0.0,1.0,1.0,0.0,0.0,0.0,0.0,0.0,0.0,0.0,0.0,1.0,0.0,0.0,0.0,0.0,0.0,0.0,0.0
Flashdance,['English'],['United States of America'],6.5,1983-04-14,95,"Alex Owens, a teen juggling between two odd jobs, aspires to become a successful ballet dancer. Nick, who is her boss and lover, supports and encourages her to fulfil her dream.",0.0,0.0,0.0,0.0,0.0,0.0,1.0,1.0,0.0,0.0,0.0,0.0,0.0,0.0,0.0,0.0,0.0,0.0,0.0
Stuttgart Shanghai,"['German', 'Mandarin']","['China', 'Germany']",5.0,2007-03-01,60,A young pair from Stuttgart fly to Shanghai to hop aboard the textile business of his father while she prepares for the birth of their son. A story about the ever more common movement of Germans into the East for professional gain.,0.0,0.0,0.0,0.0,0.0,0.0,0.0,0.0,0.0,0.0,0.0,0.0,0.0,1.0,0.0,0.0,0.0,0.0,0.0
Not Here to Be Loved,"['French', 'Portuguese']",['France'],6.8,2005-10-12,93,"Jean-Claude Delsart, a 50 years-old bailiff, with his worn-out smile and heart, abandoned a long time ago the idea that life could give him pleasures. Until the day, he dares to push the doors of a tango lesson...",0.0,0.0,0.0,0.0,0.0,0.0,1.0,1.0,0.0,0.0,0.0,0.0,0.0,0.0,0.0,0.0,0.0,0.0,0.0
Janine F.,['German'],['Germany'],5.0,2004-02-11,52,The humorous portrait of a female artist. The film follows the career of 24-year-old Janine F. who in 2002 caused a commotion from the rooftop of a Berlin building.,,,,,,,,,,,,,,,,,,,
Psycho,['English'],['United States of America'],8.4,1960-06-22,109,"When larcenous real estate clerk Marion Crane goes on the lam with a wad of cash and hopes of starting a new life, she ends up at the notorious Bates Motel, where manager Norman Bates cares for his housebound mother.",0.0,0.0,0.0,0.0,0.0,0.0,1.0,0.0,0.0,0.0,1.0,1.0,0.0,0.0,0.0,0.0,0.0,0.0,0.0
D.E.B.S.,['English'],['United States of America'],6.4,2004-01-21,91,The star of a team of teenage crime fighters falls for the alluring villainess she must bring to justice.,0.0,1.0,0.0,0.0,0.0,1.0,0.0,1.0,0.0,0.0,0.0,0.0,0.0,0.0,0.0,0.0,0.0,0.0,0.0
The Man with the Golden Arm,"['Spanish', 'English']",['United States of America'],7.2,1955-12-26,119,A junkie must face his true self to kick his drug addiction.,0.0,0.0,0.0,0.0,0.0,0.0,1.0,0.0,0.0,0.0,0.0,0.0,0.0,0.0,0.0,0.0,0.0,0.0,0.0
The Crime of Padre Amaro,['Spanish'],['Mexico'],6.5,2002-10-01,118,The young Father Amaro is put to the test. He is sent to Mexico to help take care of aging Father Benito when he meets a 16-year-old girl that he begins and affair with. It turns out the girls mother had been having an affair with Father Benito. Father Amaro must soon choose between the holy or the sinful life.,0.0,0.0,0.0,0.0,0.0,0.0,1.0,1.0,0.0,0.0,0.0,0.0,0.0,0.0,0.0,0.0,0.0,0.0,0.0
Blackmail,['English'],['United Kingdom'],6.6,1929-07-28,86,"London, 1929. Frank Webber, a very busy Scotland Yard detective, seems to be more interested in his work than in Alice White, his girlfriend. Feeling herself ignored, Alice agrees to go out with an elegant and well-mannered artist who invites her to visit his fancy apartment.",0.0,0.0,0.0,0.0,0.0,0.0,1.0,0.0,0.0,0.0,0.0,1.0,0.0,0.0,0.0,0.0,0.0,0.0,0.0
There's Something About Mary,['English'],['United States of America'],6.6,1998-07-15,119,"For Ted, prom night went about as bad as it’s possible for any night to go. Thirteen years later, he finally gets another chance with his old prom date, only to run up against other suitors including the sleazy detective he hired to find her.",0.0,0.0,0.0,0.0,0.0,1.0,0.0,1.0,0.0,0.0,0.0,0.0,0.0,0.0,0.0,0.0,0.0,0.0,0.0
Transamerica,"['Spanish', 'English']",['United States of America'],7.1,2005-12-23,103,Bree is about to get a sex reassignment surgery that will finally allow her to actually be what she’s already been in her mind for a long time: a transitioned woman. Yet before this happens she suddenly runs into her son who ends up coming for the trip across the United States.,0.0,0.0,0.0,0.0,0.0,0.0,1.0,0.0,0.0,0.0,0.0,0.0,0.0,0.0,0.0,0.0,0.0,0.0,0.0
The Horse Whisperer,['English'],['United States of America'],6.9,1998-05-14,170,The mother of a severely traumatized daughter enlists the aid of a unique horse trainer to help the girl's equally injured horse.,0.0,0.0,0.0,0.0,0.0,0.0,1.0,1.0,0.0,0.0,0.0,0.0,0.0,0.0,0.0,0.0,0.0,0.0,0.0
Rashomon,['Japanese'],['Japan'],8.2,1950-08-26,88,"Brimming with action while incisively examining the nature of truth, ""Rashomon"" is perhaps the finest film ever to investigate the philosophy of justice. Through an ingenious use of camera and flashbacks, Kurosawa reveals the complexities of human nature as four people recount different versions of the story of a man's murder and the rape of his wife.",0.0,0.0,0.0,0.0,0.0,0.0,1.0,0.0,1.0,1.0,0.0,0.0,0.0,0.0,0.0,0.0,0.0,0.0,0.0
Basquiat,"['English', 'Spanish']",['United States of America'],6.7,1996-08-09,108,"The brief life of Jean Michel Basquiat, a world renowned New York street artist struggling with fame, drugs and his identity.",0.0,0.0,0.0,0.0,0.0,0.0,1.0,0.0,0.0,0.0,0.0,0.0,0.0,0.0,0.0,0.0,0.0,1.0,0.0
Fight Club,['English'],"['Germany', 'United States of America']",8.4,1999-10-15,139,"A ticking-time-bomb insomniac and a slippery soap salesman channel primal male aggression into a shocking new form of therapy. Their concept catches on, with underground ""fight clubs"" forming in every town, until an eccentric gets in the way and ignites an out-of-control spiral toward oblivion.",0.0,0.0,0.0,0.0,0.0,0.0,1.0,0.0,0.0,0.0,0.0,0.0,0.0,0.0,0.0,0.0,0.0,0.0,0.0
The Poseidon Adventure,['English'],['United States of America'],7.2,1972-12-13,117,"When their ocean liner capsizes, a group of passengers struggle to survive and escape.",1.0,1.0,0.0,0.0,0.0,0.0,1.0,0.0,0.0,0.0,0.0,1.0,0.0,0.0,0.0,0.0,0.0,0.0,0.0
Bread and Tulips,['Italian'],['Italy'],7.3,2000-03-03,114,An endearing light comedy about a woman who spontaneously becomes a resident of Venice after her family left her begin. While enjoying the wonderful people she meets she achieves a new life and the first time independent of her family.,0.0,0.0,0.0,0.0,0.0,1.0,0.0,1.0,0.0,0.0,0.0,0.0,0.0,0.0,0.0,0.0,0.0,0.0,0.0
Dogville,['English'],"['Denmark', 'France', 'Netherlands', 'United Kingdom', 'Sweden', 'Germany']",7.8,2003-05-19,178,"A barren soundstage is stylishly utilized to create a minimalist small-town setting in which a mysterious woman named Grace hides from the criminals who pursue her. The town is two-faced and offers to harbor Grace as long as she can make it worth their effort, so Grace works hard under the employ of various townspeople to win their favor. Tensions flare, however, and Grace's status as a helpless outsider provokes vicious contempt and abuse from the citizens of Dogville.",0.0,0.0,0.0,0.0,0.0,0.0,1.0,0.0,0.0,1.0,0.0,1.0,0.0,0.0,0.0,0.0,0.0,0.0,0.0
The Cuckoo,"['German', 'Russian', 'Finnish']","['Finland', 'Russia']",7.1,2002-01-01,100,"September of 1944, a few days before Finland went out of the Second World War. A chained to a rock Finnish sniper-kamikadze Veikko managed to set himself free. Ivan, a captain of the Soviet Army, arrested by the Front Secret Police 'Smersh', has a narrow escape. They are soldiers of the two enemy armies. A Lapp woman Anni gives a shelter to both of them at her farm. For Anni they are not enemies, but just men.",0.0,0.0,0.0,0.0,0.0,1.0,1.0,1.0,0.0,0.0,0.0,0.0,0.0,0.0,0.0,0.0,0.0,1.0,0.0
Absolut,['French'],['Switzerland'],7.9,2005-04-20,94,Two guys against globalization want to plant a virus in the network of a finance corporation. On the day of the attack Alex has an accident and cannot remember anything.,0.0,0.0,0.0,0.0,0.0,0.0,0.0,0.0,0.0,0.0,0.0,1.0,0.0,0.0,0.0,0.0,0.0,0.0,0.0
Spider-Man,['English'],['United States of America'],7.2,2002-05-01,121,"After being bitten by a genetically altered spider at Oscorp, nerdy but endearing high school student Peter Parker is endowed with amazing powers to become the superhero known as Spider-Man.",0.0,1.0,0.0,0.0,0.0,0.0,0.0,0.0,0.0,0.0,0.0,0.0,1.0,0.0,0.0,0.0,0.0,0.0,0.0
Spider-Man 2,"['English', 'Russian', 'Mandarin']",['United States of America'],7.2,2004-06-25,127,"Peter Parker is going through a major identity crisis. Burned out from being Spider-Man, he decides to shelve his superhero alter ego, which leaves the city suffering in the wake of carnage left by the evil Doc Ock. In the meantime, Parker still can't act on his feelings for Mary Jane Watson, a girl he's loved since childhood. A certain anger begins to brew in his best friend Harry Osborn as well...",1.0,1.0,0.0,0.0,0.0,0.0,0.0,0.0,0.0,0.0,0.0,0.0,1.0,0.0,0.0,0.0,0.0,0.0,0.0
Spider-Man 3,"['English', 'French']",['United States of America'],6.4,2007-05-01,139,"The seemingly invincible Spider-Man goes up against an all-new crop of villains—including the shape-shifting Sandman. While Spider-Man’s superpowers are altered by an alien organism, his alter ego, Peter Parker, deals with nemesis Eddie Brock and also gets caught up in a love triangle.",1.0,1.0,0.0,0.0,0.0,0.0,0.0,0.0,0.0,0.0,0.0,0.0,1.0,0.0,0.0,0.0,0.0,0.0,0.0
Secret Beyond the Door,['English'],['United States of America'],6.5,1947-12-24,99,Fritz Lang’s psycho thriller tells the story of a woman who marries a stranger with a deadly hobby and through their love he attempts to fight off his obsessive-compulsive actions.,0.0,0.0,0.0,0.0,0.0,0.0,0.0,1.0,1.0,1.0,0.0,1.0,0.0,0.0,0.0,0.0,0.0,0.0,0.0
Constantine,"['English', 'Tagalog']","['Germany', 'United States of America']",7.0,2005-02-08,121,"John Constantine has literally been to Hell and back. When he teams up with a policewoman to solve the mysterious suicide of her twin sister, their investigation takes them through the world of demons and angels that exists beneath the landscape of contemporary Los Angeles.",0.0,1.0,0.0,0.0,0.0,0.0,0.0,0.0,0.0,0.0,1.0,0.0,1.0,0.0,0.0,0.0,0.0,0.0,0.0
Die Hard,"['English', 'German', 'Italian']",['United States of America'],7.7,1988-07-15,131,"NYPD cop John McClane's plan to reconcile with his estranged wife is thrown for a serious loop when, minutes after he arrives at her office, the entire building is overtaken by a group of terrorists. With little help from the LAPD, wisecracking McClane sets out to single-handedly rescue the hostages and bring the bad guys down.",0.0,1.0,0.0,0.0,0.0,0.0,0.0,0.0,0.0,0.0,0.0,1.0,0.0,0.0,0.0,0.0,0.0,0.0,0.0
Starship Troopers,['English'],['United States of America'],7.0,1997-11-07,129,"Set in the future, the story follows a young soldier named Johnny Rico and his exploits in the Mobile Infantry. Rico's military career progresses from recruit to non-commissioned officer and finally to officer against the backdrop of an interstellar war between mankind and an arachnoid species known as ""the Bugs"".",1.0,1.0,1.0,0.0,0.0,0.0,0.0,0.0,0.0,0.0,0.0,1.0,0.0,0.0,0.0,0.0,0.0,0.0,0.0
The Mummy,"['English', 'Arabic']",['United States of America'],6.9,1999-04-16,124,Dashing legionnaire Rick O'Connell stumbles upon the hidden ruins of Hamunaptra while in the midst of a battle to claim the area in 1920s Egypt. It has been over three thousand years since former High Priest Imhotep suffered a fate worse than death as a punishment for a forbidden love—along with a curse that guarantees eternal doom upon the world if he is ever awoken.,1.0,1.0,0.0,0.0,0.0,0.0,0.0,0.0,0.0,0.0,0.0,0.0,1.0,0.0,0.0,0.0,0.0,0.0,0.0
The Ring,['English'],"['Japan', 'United States of America']",6.6,2002-10-18,115,Rachel Keller is a journalist investigating a videotape that may have killed four teenagers. There is an urban legend about this tape: the viewer will die seven days after watching it. Rachel tracks down the video... and watches it. Now she has just seven days to unravel the mystery of the Ring so she can save herself and her son.,0.0,0.0,0.0,0.0,0.0,0.0,0.0,0.0,1.0,0.0,1.0,0.0,0.0,0.0,0.0,0.0,0.0,0.0,0.0
Rear Window,['English'],['United States of America'],8.4,1954-09-01,112,A wheelchair-bound photographer spies on his neighbors from his apartment window and becomes convinced one of them has committed murder.,0.0,0.0,0.0,0.0,0.0,0.0,0.0,0.0,1.0,0.0,0.0,1.0,0.0,0.0,0.0,0.0,0.0,0.0,0.0
Apollo 13,['English'],['United States of America'],7.4,1995-06-30,140,"The true story of technical troubles that scuttle the Apollo 13 lunar mission in 1970, risking the lives of astronaut Jim Lovell and his crew, with the failed journey turning into a thrilling saga of heroism. Drifting more than 200,000 miles from Earth, the astronauts work furiously with the ground crew to avert tragedy.",1.0,0.0,0.0,0.0,0.0,0.0,1.0,0.0,0.0,0.0,0.0,0.0,0.0,0.0,0.0,0.0,0.0,1.0,0.0
Fat Girl,"['English', 'French', 'Italian']","['France', 'Italy']",6.2,2001-03-07,86,"Anaïs is twelve and bears the weight of the world on her shoulders. She watches her older sister, Elena, whom she both loves and hates. Elena is fifteen and devilishly beautiful. Neither more futile, nor more stupid than her younger sister, she cannot understand that she is merely an object of desire. And, as such, she can only be taken. Or had. Indeed, this is the subject: a girl's loss of virginity. And, that summer, it opens a door to tragedy.",0.0,0.0,0.0,0.0,0.0,0.0,1.0,0.0,0.0,0.0,0.0,0.0,0.0,0.0,0.0,0.0,0.0,0.0,0.0
The Birds,['English'],['United States of America'],7.5,1963-03-28,119,"Chic socialite Melanie Daniels enjoys a passing flirtation with an eligible attorney in a San Francisco pet shop and, on an impulse, follows him to his hometown bearing a gift of lovebirds. But upon her arrival, the bird population runs amok. Suddenly, the townsfolk face a massive avian onslaught, with the feathered fiends inexplicably attacking people all over Bodega Bay.",0.0,0.0,0.0,0.0,0.0,0.0,0.0,0.0,0.0,0.0,1.0,0.0,0.0,0.0,0.0,0.0,0.0,0.0,0.0
Next Door,"['Norwegian', 'Swedish']","['Denmark', 'Norway', 'Sweden']",6.4,2005-03-11,75,"After Ingrid leaves John, he allows himself to be pulled into a mystical and scary world where it is impossible to separate truth from lies.",0.0,0.0,0.0,0.0,0.0,0.0,0.0,0.0,1.0,0.0,1.0,1.0,0.0,0.0,0.0,0.0,0.0,0.0,0.0
Frenzy,"['English', 'Italian']",['United Kingdom'],7.2,1972-04-14,116,"After a serial killer strangles several women with a necktie, London police identify a suspect—but he's the wrong man.",0.0,0.0,0.0,0.0,0.0,0.0,0.0,0.0,0.0,1.0,1.0,1.0,0.0,0.0,0.0,0.0,0.0,0.0,0.0
The Man Who Knew Too Much,"['Arabic', 'French', 'English']",['United States of America'],7.5,1956-05-16,120,"A widescreen, Technicolor remake by Hitchcock of his 1934 film of the same title. A couple vacationing in Morocco with their young son accidentally stumble upon an assassination plot. When the child is kidnapped to ensure their silence, they have to take matters into their own hands to save him.",0.0,0.0,0.0,0.0,0.0,0.0,1.0,0.0,1.0,1.0,0.0,1.0,0.0,0.0,0.0,0.0,0.0,0.0,0.0
The Experiment,['German'],['Germany'],7.4,2001-03-07,120,Das Experiment is a shocking psycho thriller about the potential for brutality that humans hide. Even more shocking is the fact that it’s based on an actual occurrence — a 1971 psychological experiment at Stanford University that was aborted prematurely when the experimenters lost control.,0.0,0.0,0.0,0.0,0.0,0.0,1.0,0.0,0.0,0.0,0.0,1.0,0.0,0.0,0.0,0.0,0.0,0.0,0.0
The Wild Bunch,"['German', 'English', 'Spanish', 'Italian']",['United States of America'],7.6,1969-06-17,145,"Aging outlaw Pike Bishop prepares to retire after one final robbery. Joined by his gang, Dutch Engstrom and brothers Lyle and Tector Gorch, Bishop discovers the heist is a setup orchestrated in part by a former partner, Deke Thornton. As the remaining gang takes refuge in Mexican territory, Thornton trails them—resulting in fierce gunfights with plenty of casualties.",1.0,0.0,0.0,0.0,0.0,0.0,0.0,0.0,0.0,0.0,0.0,0.0,0.0,0.0,0.0,0.0,1.0,0.0,0.0
To Die For,['English'],"['Canada', 'United Kingdom', 'United States of America']",6.6,1995-09-22,106,"Suzanne Stone wants to be a world-famous news anchor and she is willing to do anything to get what she wants. What she lacks in intelligence, she makes up for in cold determination and diabolical wiles. As she pursues her goal with relentless focus, she is forced to destroy anything and anyone that may stand in her way, regardless of the ultimate cost or means necessary.",0.0,0.0,0.0,0.0,0.0,1.0,1.0,0.0,0.0,1.0,0.0,0.0,0.0,0.0,0.0,0.0,0.0,0.0,0.0
Jaws,['English'],['United States of America'],7.6,1975-06-20,124,"When an insatiable great white shark terrorizes the townspeople of Amity Island, the police chief, an oceanographer and a grizzled shark hunter seek to destroy the blood-thirsty beast.",1.0,0.0,0.0,0.0,0.0,0.0,0.0,0.0,0.0,0.0,1.0,1.0,0.0,0.0,0.0,0.0,0.0,0.0,0.0
Jaws 2,['English'],['United States of America'],5.9,1978-06-16,116,Police chief Brody must protect the citizens of Amity after a second monstrous shark begins terrorizing the waters.,0.0,0.0,0.0,0.0,0.0,0.0,0.0,0.0,0.0,0.0,1.0,1.0,0.0,0.0,0.0,0.0,0.0,0.0,0.0
Jaws: The Revenge,['English'],['United States of America'],4.0,1987-07-17,89,"After another deadly shark attack, Ellen Brody decides she has had enough of New England's Amity Island and moves to the Caribbean to join her son, Michael, and his family. But a great white shark has followed her there, hungry for more lives.",1.0,0.0,0.0,0.0,0.0,0.0,0.0,0.0,0.0,0.0,1.0,1.0,0.0,0.0,0.0,0.0,0.0,0.0,0.0
Dances with Wolves,['English'],"['United Kingdom', 'United States of America']",7.9,1990-03-30,181,"Wounded Civil War soldier, John Dunbar tries to commit suicide—and becomes a hero instead. As a reward, he's assigned to his dream post, a remote junction on the Western frontier, and soon makes unlikely friends with the local Sioux tribe.",1.0,0.0,0.0,0.0,0.0,0.0,1.0,0.0,0.0,0.0,0.0,0.0,0.0,0.0,0.0,0.0,1.0,0.0,0.0
The Lives of Others,['German'],['Germany'],8.1,2006-03-15,137,A tragic love story set in East Berlin with the backdrop of an undercover Stasi controlled culture. Stasi captain Wieler is ordered to follow author Dreyman and plunges deeper and deeper into his life until he reaches the threshold of doubting the system.,0.0,0.0,0.0,0.0,0.0,0.0,1.0,0.0,0.0,0.0,0.0,1.0,0.0,0.0,0.0,0.0,0.0,0.0,0.0
Life of Brian,"['English', 'Latin']",['United Kingdom'],7.8,1979-08-17,94,"Brian Cohen is an average young Jewish man, but through a series of ridiculous events, he gains a reputation as the Messiah. When he's not dodging his followers or being scolded by his shrill mother, the hapless Brian has to contend with the pompous Pontius Pilate and acronym-obsessed members of a separatist movement. Rife with Monty Python's signature absurdity, the tale finds Brian's life paralleling Biblical lore, albeit with many more laughs.",0.0,0.0,0.0,0.0,0.0,1.0,0.0,0.0,0.0,0.0,0.0,0.0,0.0,0.0,0.0,0.0,0.0,0.0,0.0
2 Fast 2 Furious,"['English', 'Spanish']","['Germany', 'United States of America']",6.4,2003-06-05,108,"It's a major double-cross when former police officer Brian O'Conner teams up with his ex-con buddy Roman Pearce to transport a shipment of ""dirty"" money for shady Miami-based import-export dealer Carter Verone. But the guys are actually working with undercover agent Monica Fuentes to bring Verone down.",0.0,1.0,0.0,0.0,0.0,0.0,0.0,0.0,0.0,1.0,0.0,1.0,0.0,0.0,0.0,0.0,0.0,0.0,0.0
"Monsters, Inc.",['English'],['United States of America'],7.8,2001-11-01,92,"James Sullivan and Mike Wazowski are monsters, they earn their living scaring children and are the best in the business... even though they're more afraid of the children than they are of them. When a child accidentally enters their world, James and Mike suddenly find that kids are not to be afraid of and they uncover a conspiracy that could threaten all children across the world.",0.0,0.0,0.0,1.0,1.0,1.0,0.0,0.0,0.0,0.0,0.0,0.0,0.0,0.0,0.0,0.0,0.0,0.0,0.0
Wag the Dog,"['Albanian', 'English']",['United States of America'],7.0,1997-12-25,97,"During the final weeks of a presidential race, the President is accused of sexual misconduct. To distract the public until the election, the President's adviser hires a Hollywood producer to help him stage a fake war.",0.0,0.0,0.0,0.0,0.0,1.0,1.0,0.0,0.0,0.0,0.0,0.0,0.0,0.0,0.0,0.0,0.0,0.0,0.0
Big Fish,['English'],['United States of America'],7.8,2003-12-25,125,"Throughout his life Edward Bloom has always been a man of big appetites, enormous passions and tall tales. In his later years, he remains a huge mystery to his son, William. Now, to get to know the real man, Will begins piecing together a true picture of his father from flashbacks of his amazing adventures.",1.0,0.0,0.0,0.0,0.0,0.0,1.0,0.0,0.0,0.0,0.0,0.0,1.0,0.0,0.0,0.0,0.0,0.0,0.0
Silent Hill,['English'],"['Canada', 'France', 'Japan', 'United States of America']",6.5,2006-04-21,125,"In search for answers, a mother travels to the enigmatic town of Silent Hill when her daughter begins to suffer recurring nightmares related to the place. It doesn't take long for her to discover its home to beings as equally haunting as the town itself.",0.0,0.0,0.0,0.0,0.0,0.0,0.0,0.0,1.0,0.0,1.0,0.0,0.0,0.0,0.0,0.0,0.0,0.0,0.0
The Hours,['English'],['United States of America'],7.3,2002-12-27,114,"""The Hours"" is the story of three women searching for more potent, meaningful lives. Each is alive at a different time and place, all are linked by their yearnings and their fears. Their stories intertwine, and finally come together in a surprising, transcendent moment of shared recognition.",0.0,0.0,0.0,0.0,0.0,0.0,1.0,0.0,0.0,0.0,0.0,0.0,0.0,0.0,0.0,0.0,0.0,0.0,0.0
The Da Vinci Code,"['English', 'French', 'Latin', 'Spanish']",['United States of America'],6.7,2006-05-17,149,"A murder in Paris’ Louvre Museum and cryptic clues in some of Leonardo da Vinci’s most famous paintings lead to the discovery of a religious mystery. For 2,000 years a secret society closely guards information that — should it come to light — could rock the very foundations of Christianity.",0.0,0.0,0.0,0.0,0.0,0.0,0.0,0.0,1.0,0.0,0.0,1.0,0.0,0.0,0.0,0.0,0.0,0.0,0.0
The Conversation,['English'],['United States of America'],7.6,1974-04-07,113,"Surveillance expert Harry Caul is hired by a mysterious client's brusque aide to tail a young couple. Tracking the pair through San Francisco's Union Square, Caul and his associate Stan manage to record a cryptic conversation between them. Tormented by memories of a previous case that ended badly, Caul becomes obsessed with the resulting tape, trying to determine if the couple is in danger.",0.0,0.0,0.0,0.0,0.0,0.0,1.0,0.0,1.0,1.0,0.0,0.0,0.0,0.0,0.0,0.0,0.0,0.0,0.0
Solaris,['Russian'],['Soviet Union'],7.9,1972-03-20,167,A psychologist is sent to a space station orbiting a planet called Solaris to investigate the death of a doctor and the mental problems of cosmonauts on the station. He soon discovers that the water on the planet is a type of brain which brings out repressed memories and obsessions.,0.0,0.0,1.0,0.0,0.0,0.0,1.0,0.0,1.0,0.0,0.0,0.0,0.0,0.0,0.0,0.0,0.0,0.0,0.0
The Terminal,"['Bulgarian', 'English', 'French', 'Russian', 'Spanish']",['United States of America'],7.3,2004-06-17,128,"Viktor Navorski is a man without a country; his plane took off just as a coup d'etat exploded in his homeland, leaving it in shambles, and now he's stranded at Kennedy Airport, where he's holding a passport that nobody recognizes. While quarantined in the transit lounge until authorities can figure out what to do with him, Viktor simply goes on living – and courts romance with a beautiful flight attendant.",0.0,0.0,0.0,0.0,0.0,1.0,1.0,0.0,0.0,0.0,0.0,0.0,0.0,0.0,0.0,0.0,0.0,0.0,0.0
To Kill a Mockingbird,['English'],['United States of America'],8.0,1962-12-20,129,"Scout Finch, 6, and her older brother Jem live in sleepy Maycomb, Alabama, spending much of their time with their friend Dill and spying on their reclusive and mysterious neighbor, Boo Radley. When Atticus, their widowed father and a respected lawyer, defends a black man named Tom Robinson against fabricated rape charges, the trial and tangent events expose the children to evils of racism and stereotyping.",0.0,0.0,0.0,0.0,0.0,0.0,1.0,0.0,0.0,1.0,0.0,0.0,0.0,0.0,0.0,0.0,0.0,0.0,0.0
