title,spoken_languages,production_countries,vote_average,release_date,runtime,overview,Adventure,Action,Science Fiction,Animation,Family,Comedy,Drama,Romance,Mystery,Crime,Horror,Thriller,Fantasy,Documentary,War,Music,Western,History,TV Movie
Terminator 2: Judgment Day,"['English', 'Spanish']","['France', 'United States of America']",8.1,1991-07-03,137,"Nearly 10 years have passed since Sarah Connor was targeted for termination by a cyborg from the future. Now her son, John, the future leader of the resistance, is the target for a newer, more deadly terminator. Once again, the resistance has managed to send a protector back to attempt to save John and his mother Sarah.",0.0,1.0,1.0,0.0,0.0,0.0,0.0,0.0,0.0,0.0,0.0,1.0,0.0,0.0,0.0,0.0,0.0,0.0,0.0
Strange Days,['English'],['United States of America'],7.0,1995-10-13,145,"Set in the year 1999 during the last days of the old millennium, the movie tells the story of Lenny Nero, an ex-cop who now deals with data-discs containing recorded memories and emotions. One day he receives a disc which contains the memories of a murderer killing a prostitute. Lenny investigates and is pulled deeper and deeper in a whirl of blackmail, murder and rape. Will he survive and solve the case?",0.0,0.0,1.0,0.0,0.0,0.0,1.0,0.0,0.0,1.0,0.0,1.0,0.0,0.0,0.0,0.0,0.0,0.0,0.0
The Apartment,['English'],['United States of America'],8.2,1960-06-21,125,"Bud Baxter is a minor clerk in a huge New York insurance company, until he discovers a quick way to climb the corporate ladder. He lends out his apartment to the executives as a place to take their mistresses. Although he often has to deal with the aftermath of their visits, one night he's left with a major problem to solve.",0.0,0.0,0.0,0.0,0.0,1.0,1.0,1.0,0.0,0.0,0.0,0.0,0.0,0.0,0.0,0.0,0.0,0.0,0.0
Pirates of the Caribbean: At World's End,['English'],['United States of America'],7.2,2007-05-19,169,"Captain Barbossa, long believed to be dead, has come back to life and is headed to the edge of the Earth with Will Turner and Elizabeth Swann. But nothing is quite as it seems.",1.0,1.0,0.0,0.0,0.0,0.0,0.0,0.0,0.0,0.0,0.0,0.0,1.0,0.0,0.0,0.0,0.0,0.0,0.0
Germany: A Summer's Fairytale,['German'],['Germany'],6.7,2006-10-03,110,A documentary of the German national soccer team’s 2006 World Cup experience that changed the face of modern Germany.,0.0,0.0,0.0,0.0,0.0,0.0,0.0,0.0,0.0,0.0,0.0,0.0,0.0,1.0,0.0,0.0,0.0,0.0,0.0
Bull Durham,['English'],['United States of America'],6.7,1988-06-15,108,"Veteran catcher Crash Davis is brought to the minor league Durham Bulls to help their up and coming pitching prospect, ""Nuke"" Laloosh. Their relationship gets off to a rocky start and is further complicated when baseball groupie Annie Savoy sets her sights on the two men.",0.0,0.0,0.0,0.0,0.0,1.0,0.0,1.0,0.0,0.0,0.0,0.0,0.0,0.0,0.0,0.0,0.0,0.0,0.0
High Noon,"['English', 'Italian']",['United States of America'],7.7,1952-06-09,85,"Will Kane, the sheriff of a small town in New Mexico, learns a notorious outlaw he put in jail has been freed, and will be arriving on the noon train. Knowing the outlaw and his gang are coming to kill him, Kane is determined to stand his ground, so he attempts to gather a posse from among the local townspeople.",0.0,0.0,0.0,0.0,0.0,0.0,0.0,0.0,0.0,0.0,0.0,1.0,0.0,0.0,0.0,0.0,1.0,0.0,0.0
Casablanca,"['German', 'French', 'Italian', 'English']",['United States of America'],8.2,1942-11-26,102,"In Casablanca, Morocco in December 1941, a cynical American expatriate meets a former lover, with unforeseen complications.",0.0,0.0,0.0,0.0,0.0,0.0,1.0,1.0,0.0,0.0,0.0,0.0,0.0,0.0,0.0,0.0,0.0,0.0,0.0
Barton Fink,['English'],"['United Kingdom', 'United States of America']",7.5,1991-08-01,117,A renowned New York playwright is enticed to California to write for the movies and discovers the hellish truth of Hollywood.,0.0,0.0,0.0,0.0,0.0,1.0,1.0,0.0,0.0,0.0,0.0,0.0,0.0,0.0,0.0,0.0,0.0,0.0,0.0
Riding Giants,['English'],"['France', 'United States of America']",7.6,2004-07-09,105,Riding Giants is story about big wave surfers who have become heroes and legends in their sport. Directed by the skateboard guru Stacy Peralta.,0.0,0.0,0.0,0.0,0.0,0.0,0.0,0.0,0.0,0.0,0.0,0.0,0.0,1.0,0.0,0.0,0.0,0.0,0.0
Dave Chappelle's Block Party,"['German', 'English']",['United States of America'],6.7,2005-09-12,100,"The American comedian/actor delivers a story about the alternative Hip Hop scene. A small town Ohio mans moves to Brooklyn, New York, to throw an unprecedented block party.",0.0,0.0,0.0,0.0,0.0,1.0,0.0,0.0,0.0,0.0,0.0,0.0,0.0,1.0,0.0,1.0,0.0,0.0,0.0
A River Runs Through It,['English'],['United States of America'],7.1,1992-10-09,123,"A River Runs Through is a cinematographically stunning true story of Norman Maclean. The story follows Norman and his brother Paul through the experiences of life and growing up, and how their love of fly fishing keeps them together despite varying life circumstances in the untamed west of Montana in the 1920's.",0.0,0.0,0.0,0.0,1.0,0.0,1.0,0.0,0.0,0.0,0.0,0.0,0.0,0.0,0.0,0.0,0.0,0.0,0.0
Desert Hearts,['English'],['United States of America'],7.1,1985-10-01,91,The story of straight-edge literature professor Vivian who travels to Reno to get away from a relationship breakup when she falls in love with an attractive and unconventional girl named Cay.,0.0,0.0,0.0,0.0,0.0,0.0,1.0,1.0,0.0,0.0,0.0,0.0,0.0,0.0,0.0,0.0,0.0,0.0,0.0
Terminator 3: Rise of the Machines,['English'],"['Germany', 'United Kingdom', 'United States of America']",6.1,2003-07-02,109,"It's been 10 years since John Connor saved Earth from Judgment Day, and he's now living under the radar, steering clear of using anything Skynet can trace. That is, until he encounters T-X, a robotic assassin ordered to finish what T-1000 started. Good thing Connor's former nemesis, the Terminator, is back to aid the now-adult Connor … just like he promised.",0.0,1.0,1.0,0.0,0.0,0.0,0.0,0.0,0.0,0.0,0.0,1.0,0.0,0.0,0.0,0.0,0.0,0.0,0.0
Meet Joe Black,"['Dutch', 'English']",['United States of America'],7.2,1998-11-12,178,"When the grim reaper comes to collect the soul of megamogul Bill Parrish, he arrives with a proposition: Host him for a ""vacation"" among the living in trade for a few more days of existence. Parrish agrees, and using the pseudonym Joe Black, Death begins taking part in Parrish's daily agenda and falls in love with the man's daughter. Yet when Black's holiday is over, so is Parrish's life.",0.0,0.0,0.0,0.0,0.0,0.0,1.0,1.0,0.0,0.0,0.0,0.0,1.0,0.0,0.0,0.0,0.0,0.0,0.0
Ocean's Thirteen,"['Spanish', 'English', 'French']",['United States of America'],6.7,2007-06-06,122,"Danny Ocean's team of criminals are back and composing a plan more personal than ever. When ruthless casino owner Willy Bank doublecrosses Reuben Tishkoff, causing a heart attack, Danny Ocean vows that he and his team will do anything to bring down Willy Bank along with everything he's got. Even if it means asking for help from an enemy.",0.0,0.0,0.0,0.0,0.0,0.0,0.0,0.0,0.0,1.0,0.0,1.0,0.0,0.0,0.0,0.0,0.0,0.0,0.0
Ocean's Eleven,['English'],['United States of America'],6.5,1960-08-10,127,Danny Ocean and his gang attempt to rob the five biggest casinos in Las Vegas in one night.,0.0,0.0,0.0,0.0,0.0,1.0,0.0,0.0,0.0,1.0,0.0,1.0,0.0,0.0,0.0,1.0,0.0,0.0,0.0
The Science of Sleep,"['English', 'French', 'Spanish']","['France', 'Italy']",7.1,2006-02-11,105,A man entranced by his dreams and imagination is lovestruck with a French woman and feels he can show her his world.,0.0,0.0,0.0,0.0,0.0,1.0,1.0,0.0,0.0,0.0,0.0,0.0,1.0,0.0,0.0,0.0,0.0,0.0,0.0
Rio Bravo,['English'],['United States of America'],7.9,1959-03-17,141,"The sheriff of a small town in southwest Texas must keep custody of a murderer whose brother, a powerful rancher, is trying to help him escape. After a friend is killed trying to muster support for him, he and his deputies - a disgraced drunk and a cantankerous old cripple - must find a way to hold out against the rancher's hired guns until the marshal arrives. In the meantime, matters are complicated by the presence of a young gunslinger - and a mysterious beauty who just came in on the last stagecoach.",0.0,0.0,0.0,0.0,0.0,0.0,0.0,0.0,0.0,0.0,0.0,0.0,0.0,0.0,0.0,0.0,1.0,0.0,0.0
Swimming Pool,"['English', 'French']","['France', 'United Kingdom']",6.5,2003-05-21,102,"A British crime novelist travels to her publisher's upmarket summer house in Southern France to seek solitude in order to work on her next book. However, the unexpected arrival of the publisher's daughter induces complications and a subsequent crime.",0.0,0.0,0.0,0.0,0.0,0.0,0.0,0.0,0.0,1.0,0.0,1.0,0.0,0.0,0.0,0.0,0.0,0.0,0.0
Notorious,['English'],['United States of America'],7.8,1946-08-21,103,"In order to help bring Nazis to justice, U.S. government agent T.R. Devlin recruits Alicia Huberman, the American daughter of a convicted German war criminal, as a spy. As they begin to fall for one another, Alicia is instructed to win the affections of Alexander Sebastian, a Nazi hiding out in Brazil. When Sebastian becomes serious about his relationship with Alicia, the stakes get higher, and Devlin must watch her slip further undercover.",0.0,0.0,0.0,0.0,0.0,0.0,0.0,1.0,1.0,0.0,0.0,1.0,0.0,0.0,0.0,0.0,0.0,0.0,0.0
Beverly Hills Cop III,['English'],['United States of America'],5.9,1994-05-24,105,"Back in sunny southern California and on the trail of two murderers, Axel Foley again teams up with LA cop Billy Rosewood. Soon, they discover that an amusement park is being used as a front for a massive counterfeiting ring – and it's run by the same gang that shot Billy's boss.",0.0,1.0,0.0,0.0,0.0,1.0,0.0,0.0,0.0,1.0,0.0,0.0,0.0,0.0,0.0,0.0,0.0,0.0,0.0
"Rome, Open City","['German', 'Italian']",['Italy'],8.0,1945-10-08,103,A realistic portrayal of the underground resistance in Italy in 1945. The film has strong impacting imagery with its mix of fiction and reality that strengthened Italian Neo-realism and the film industry.,0.0,0.0,0.0,0.0,0.0,0.0,1.0,0.0,0.0,0.0,0.0,0.0,0.0,0.0,0.0,0.0,0.0,1.0,0.0
Broken Flowers,['English'],"['France', 'United States of America']",6.9,2005-08-05,106,"As the devoutly single Don Johnston is dumped by his latest girlfriend, he receives an anonymous pink letter informing him that he has a son who may be looking for him.",0.0,0.0,0.0,0.0,0.0,1.0,1.0,1.0,1.0,0.0,0.0,0.0,0.0,0.0,0.0,0.0,0.0,0.0,0.0
The Celebration,"['Danish', 'German', 'English']","['Denmark', 'Sweden']",7.7,1998-06-19,105,"A grandiose party to celebrate a sixtieth birthday unleashes a family drama with all the lies that conceal horrendous secrets. The eldest son, Christian, stages a showdown with the popular pater familias; his provocative, moving after-dinner speech dislodges all the masks, which finally fall completely as the father-son conflict intensifies and the bewildered guests look on.",0.0,0.0,0.0,0.0,0.0,0.0,1.0,0.0,0.0,0.0,0.0,0.0,0.0,0.0,0.0,0.0,0.0,0.0,0.0
Bruce Almighty,['English'],['United States of America'],6.7,2003-05-23,101,"Bruce Nolan toils as a 'human interest' television reporter in Buffalo, N.Y., but despite his high ratings and the love of his beautiful girlfriend, Bruce remains unfulfilled. At the end of the worst day in his life, he angrily ridicules God—and the Almighty responds, endowing Bruce with all of His divine powers.",0.0,0.0,0.0,0.0,0.0,1.0,0.0,0.0,0.0,0.0,0.0,0.0,1.0,0.0,0.0,0.0,0.0,0.0,0.0
Once Upon a Time in America,"['English', 'French', 'Hebrew', 'Italian', 'Yiddish']","['United States of America', 'Italy']",8.4,1984-05-23,229,"A former Prohibition-era Jewish gangster returns to the Lower East Side of Manhattan over thirty years later, where he once again must confront the ghosts and regrets of his old life.",0.0,0.0,0.0,0.0,0.0,0.0,1.0,0.0,0.0,1.0,0.0,0.0,0.0,0.0,0.0,0.0,0.0,0.0,0.0
Beyond Silence,['German'],['Germany'],6.9,1996-12-18,109,Beyond Silence is about a family and a young girl’s coming of age story. This German film looks into the lives of the deaf and at a story about the love for music. A girl who has always had to translate speech into sign language for her deaf parents yet when her love for playing music grows strong she must decide to continue doing something she cannot share with her parents.,0.0,0.0,0.0,0.0,0.0,0.0,1.0,0.0,0.0,0.0,0.0,0.0,0.0,0.0,0.0,0.0,0.0,0.0,0.0
Snow Cake,['English'],"['Canada', 'United Kingdom']",7.1,2006-09-08,112,A drama focused on the friendship between a high-functioning autistic woman and a man who is traumatized after a fatal car accident.,0.0,0.0,0.0,0.0,0.0,0.0,1.0,1.0,0.0,0.0,0.0,0.0,0.0,0.0,0.0,0.0,0.0,0.0,0.0
Catwoman,"['Spanish', 'English']",['United States of America'],4.6,2004-07-22,104,"A shy woman, endowed with the speed, reflexes, and senses of a cat, walks a thin line between criminal and hero, even as a detective doggedly pursues her, fascinated by both of her personas",0.0,1.0,0.0,0.0,0.0,0.0,0.0,0.0,1.0,1.0,0.0,0.0,1.0,0.0,0.0,0.0,0.0,0.0,0.0
"Faster, Pussycat! Kill! Kill!",['English'],['United States of America'],6.5,1965-08-06,84,"Three strippers seeking thrills encounter a young couple in the desert. After dispatching the boyfriend, they take the girl hostage and begin scheming on a crippled old man living with his two sons in the desert, reputedly hiding a tidy sum of cash. They become house guests of the old man and try and seduce the sons in an attempt to locate the money, not realizing that the old man has a few sinister intentions of his own.",0.0,1.0,0.0,0.0,0.0,1.0,0.0,0.0,0.0,1.0,0.0,0.0,0.0,0.0,0.0,0.0,0.0,0.0,0.0
Grill Point,['German'],['Germany'],6.6,2002-02-12,111,In the style of a documentary this tragic comedy tells the story of a relationship crisis between two married couples and their longing to break out of their miserable daily lives. In this East German post-wall movie Andreas Dresen introduces the sad everyday life of two couples from Frankfurt an der Oder in a honest and tolerable manner.,0.0,0.0,0.0,0.0,0.0,1.0,1.0,0.0,0.0,0.0,0.0,0.0,0.0,0.0,0.0,0.0,0.0,0.0,0.0
Grbavica: The Land of My Dreams,['Bosnian'],"['Bosnia and Herzegovina', 'Austria', 'Germany', 'Croatia']",6.8,2006-03-01,90,A woman and her daughter struggle to make their way through the aftermath of the Balkan war.,0.0,0.0,0.0,0.0,0.0,0.0,1.0,0.0,0.0,0.0,0.0,0.0,0.0,0.0,0.0,0.0,0.0,1.0,0.0
The Million Dollar Hotel,['English'],"['United States of America', 'Germany']",5.9,2000-02-09,122,The Million Dollar Hotel starts with a jump from a roof top that clears up a death in a hotel that was burning to the ground where a lot of strange people had been living.,0.0,0.0,0.0,0.0,0.0,0.0,1.0,0.0,0.0,0.0,0.0,1.0,0.0,0.0,0.0,0.0,0.0,0.0,0.0
True Romance,"['English', 'Italian']",['United States of America'],7.5,1993-09-09,120,"Clarence marries hooker Alabama, steals cocaine from her pimp, and tries to sell it in Hollywood, while the owners of the coke try to reclaim it.",0.0,1.0,0.0,0.0,0.0,0.0,0.0,1.0,0.0,1.0,0.0,1.0,0.0,0.0,0.0,0.0,0.0,0.0,0.0
Insomnia,['English'],['United States of America'],6.9,2002-05-24,118,Two Los Angeles homicide detectives are dispatched to a northern town where the sun doesn't set to investigate the methodical murder of a local teen.,0.0,0.0,0.0,0.0,0.0,0.0,0.0,0.0,1.0,1.0,0.0,1.0,0.0,0.0,0.0,0.0,0.0,0.0,0.0
Mambo Italiano,"['English', 'French', 'Italian']",['Canada'],5.9,2003-06-06,89,"When an Italian man comes out of the closet, it affects both his life and his crazy family.",0.0,0.0,0.0,0.0,0.0,1.0,0.0,1.0,0.0,0.0,0.0,0.0,0.0,0.0,0.0,0.0,0.0,0.0,0.0
Mystic River,['English'],['United States of America'],7.7,2003-01-01,138,The lives of three men who were childhood friends are shattered when one of them has a family tragedy.,0.0,0.0,0.0,0.0,0.0,0.0,1.0,0.0,1.0,1.0,0.0,1.0,0.0,0.0,0.0,0.0,0.0,0.0,0.0
Snakes on a Plane,['English'],['United States of America'],5.3,2006-08-06,105,"America is on the search for the murderer Eddie Kim. Sean Jones must fly to L.A. to testify in a hearing against Kim. Accompanied by FBI agent Neville Flynn, the flight receives some unexpected visitors.",0.0,1.0,0.0,0.0,0.0,0.0,0.0,0.0,0.0,1.0,1.0,1.0,0.0,0.0,0.0,0.0,0.0,0.0,0.0
Brother,"['English', 'Italian', 'Japanese', 'Spanish']","['United States of America', 'Japan', 'United Kingdom']",7.1,2000-12-13,114,"A Japanese Yakuza gangster’s deadly existence in his homeland gets him exiled to Los Angeles, where he is taken in by his little brother and his brother’s gang.",0.0,0.0,0.0,0.0,0.0,0.0,1.0,0.0,0.0,1.0,0.0,1.0,0.0,0.0,0.0,0.0,0.0,0.0,0.0
Jurassic Park,"['English', 'Spanish']",['United States of America'],7.9,1993-06-11,127,"A wealthy entrepreneur secretly creates a theme park featuring living dinosaurs drawn from prehistoric DNA. Before opening day, he invites a team of experts and his two eager grandchildren to experience the park and help calm anxious investors. However, the park is anything but amusing as the security systems go off-line and the dinosaurs escape.",1.0,0.0,1.0,0.0,0.0,0.0,0.0,0.0,0.0,0.0,0.0,0.0,0.0,0.0,0.0,0.0,0.0,0.0,0.0
The Lost World: Jurassic Park,['English'],['United States of America'],6.5,1997-05-23,129,"Four years after Jurassic Park's genetically bred dinosaurs ran amok, multimillionaire John Hammond shocks chaos theorist Ian Malcolm by revealing that he has been breeding more beasties at a secret location. Malcolm, his paleontologist ladylove and a wildlife videographer join an expedition to document the lethal lizards' natural behavior in this action-packed thriller.",1.0,1.0,1.0,0.0,0.0,0.0,0.0,0.0,0.0,0.0,0.0,0.0,0.0,0.0,0.0,0.0,0.0,0.0,0.0
Jurassic Park III,"['English', 'Spanish']",['United States of America'],6.1,2001-07-18,92,"In need of funds for research, Dr. Alan Grant accepts a large sum of money to accompany Paul and Amanda Kirby on an aerial tour of the infamous Isla Sorna. It isn't long before all hell breaks loose and the stranded wayfarers must fight for survival as a host of new -- and even more deadly -- dinosaurs try to make snacks of them.",1.0,1.0,1.0,0.0,0.0,0.0,0.0,0.0,0.0,0.0,0.0,1.0,0.0,0.0,0.0,0.0,0.0,0.0,0.0
Inspector Gadget,"['English', 'Norwegian', 'French', 'Spanish']",['United States of America'],4.4,1999-07-23,78,"John Brown is a bumbling but well-intentioned security guard who is badly injured in an explosion planned by an evil mastermind. He is taken to a laboratory, where Brenda, a leading robotics surgeon, replaces his damaged limbs with state-of-the-art gadgets and tools. Named ""Inspector Gadget"" by the press, John -- along with his niece, Penny, and her trusty dog, Brain -- uses his new powers to discover who was behind the explosion.",1.0,1.0,0.0,0.0,1.0,1.0,0.0,0.0,0.0,0.0,0.0,0.0,0.0,0.0,0.0,0.0,0.0,0.0,0.0
Bollywood/Hollywood,['English'],['Canada'],6.4,2002-01-01,101,"Rahul Seth is a dashing young millionaire who believes he is ""western"" enough to rebel against his mother and grandmother. They are not too keen about his Caucasian girlfriend Kimberly who, to make matters worse, is a pop star. Before you can say ""karmic intervention,"" Kimberly dies in a freak accident and Rahul is devastated. Instead of allowing him to mourn in peace, Rahul's mother sees the opportunity she's been waiting for. She threatens to call off his sister's wedding unless he finds himself a ""nice Indian girl."" Rahul enlists the services of Sue, a fiercely independent escort whom he believes to be Hispanic, and therefore not ""married"" to the conventions taught to young Indian women. With a wink in her eye, Sue accepts the deal to pose as his Indian bride-to-be. She needs the money and having never been a fan of the typical Indian male, she feels her heart is safe. The charade begins....",0.0,0.0,0.0,0.0,0.0,1.0,1.0,1.0,0.0,0.0,0.0,0.0,0.0,0.0,0.0,1.0,0.0,0.0,0.0
Magnolia,"['English', 'French', 'German']",['United States of America'],7.7,1999-12-10,189,"An epic mosaic of many interrelated characters in search of happiness, forgiveness, and meaning in the San Fernando Valley.",0.0,0.0,0.0,0.0,0.0,0.0,1.0,0.0,0.0,0.0,0.0,0.0,0.0,0.0,0.0,0.0,0.0,0.0,0.0
Once Upon a Time in the West,['English'],"['Italy', 'United States of America']",8.3,1968-12-21,166,"As the railroad builders advance unstoppably through the Arizona desert on their way to the sea, Jill arrives in the small town of Flagstone with the intention of starting a new life.",0.0,0.0,0.0,0.0,0.0,0.0,1.0,0.0,0.0,0.0,0.0,0.0,0.0,0.0,0.0,0.0,1.0,0.0,0.0
"Duck, You Sucker","['Spanish', 'Italian']","['Spain', 'Italy']",7.7,1971-10-20,157,"At the beginning of the 1913 Mexican Revolution, greedy bandit Juan Miranda and idealist John H. Mallory, an Irish Republican Army explosives expert on the lam from the British, fall in with a band of revolutionaries plotting to strike a national bank. When it turns out that the government has been using the bank as a hiding place for illegally detained political prisoners -- who are freed by the blast -- Miranda becomes a revolutionary hero against his will.",0.0,0.0,0.0,0.0,0.0,0.0,0.0,0.0,0.0,0.0,0.0,0.0,0.0,0.0,0.0,0.0,1.0,0.0,0.0
Monsieur Ibrahim,"['French', 'Turkish']",['France'],7.0,2003-09-17,91,"Paris, 1960s. Momo, a resolute and independent Jewish teenager who lives with his father, a sullen and depressed man, in a working-class neighborhood, develops a close friendship with Monsieur Ibrahim, an elderly Muslim who owns a small grocery store.",0.0,0.0,0.0,0.0,0.0,0.0,1.0,0.0,0.0,0.0,0.0,0.0,0.0,0.0,0.0,0.0,0.0,0.0,0.0
Good Bye Lenin!,['German'],['Germany'],7.6,2003-02-09,121,Alex Kerner's mother was in a coma while the Berlin wall fell. When she wakes up he must try to keep her from learning what happened (as she was an avid communist supporter) to avoid shocking her which could lead to another heart attack.,0.0,0.0,0.0,0.0,0.0,1.0,1.0,0.0,0.0,0.0,0.0,0.0,0.0,0.0,0.0,0.0,0.0,0.0,0.0
Night on Earth,"['English', 'Finnish', 'French', 'German', 'Italian']","['Germany', 'France', 'Japan', 'United Kingdom', 'United States of America']",7.5,1991-12-12,128,An anthology of 5 different cab drivers in 5 American and European cities and their remarkable fares on the same eventful night.,0.0,0.0,0.0,0.0,0.0,1.0,1.0,0.0,0.0,0.0,0.0,0.0,0.0,0.0,0.0,0.0,0.0,0.0,0.0
Everything Is Illuminated,"['English', 'Russian', 'Ukrainian']",['United States of America'],7.3,2005-09-16,106,"A young Jewish American man endeavors—with the help of eccentric, distant relatives—to find the woman who saved his grandfather during World War II—in a Ukrainian village which was ultimately razed by the Nazis.",0.0,0.0,0.0,0.0,0.0,1.0,1.0,0.0,0.0,0.0,0.0,0.0,0.0,0.0,0.0,0.0,0.0,0.0,0.0
A Crime,['English'],"['France', 'United States of America']",5.8,2006-09-11,103,"Vincent's life is on hold until he finds his wife's killer. Alice, his neighbor, is convinced she can make him happy. She decides to invent a culprit, so that Vincent can find revenge and leave the past behind. But there is no ideal culprit and no perfect crime.",0.0,0.0,0.0,0.0,0.0,0.0,0.0,0.0,0.0,1.0,0.0,0.0,0.0,0.0,0.0,0.0,0.0,0.0,0.0
Summer Storm,['German'],['Germany'],6.8,2004-09-02,98,"Tobi and Achim, the pride of the local crew club, have been the best of friends for years and are convinced that nothing will ever stand in the way of their friendship. They look forward to the upcoming summer camp and the crew competition. Then the gay team from Berlin arrives and Tobi is totally confused. The evening before the races begin, the storm that breaks out is more than meteorlogical...",0.0,0.0,0.0,0.0,0.0,1.0,1.0,0.0,0.0,0.0,0.0,0.0,0.0,0.0,0.0,0.0,0.0,0.0,0.0
Harold and Maude,['English'],['United States of America'],7.7,1971-12-20,91,The young Harold lives in his own world of suicide-attempts and funeral visits to avoid the misery of his current family and home environment. Harold meets an 80-year-old woman named Maude who also lives in her own world yet one in which she is having the time of her life. When the two opposites meet they realize that their differences don’t matter and they become best friends and love each other.,0.0,0.0,0.0,0.0,0.0,1.0,1.0,1.0,0.0,0.0,0.0,0.0,0.0,0.0,0.0,0.0,0.0,0.0,0.0
"Bang, Boom, Bang",['German'],['Germany'],7.5,1999-08-26,110,Bank robber Kalle Grabowski escapes from prison while his unemployed smalltime crook buddy is sitting around doing nothing after he just lost all their money. A fast paced comedy from German director Peter Thorwarth.,0.0,1.0,0.0,0.0,0.0,1.0,0.0,0.0,0.0,1.0,0.0,0.0,0.0,0.0,0.0,0.0,0.0,0.0,0.0
Eyes Wide Shut,['English'],"['United Kingdom', 'United States of America']",7.5,1999-07-16,159,"After Dr. Bill Harford's wife, Alice, admits to having sexual fantasies about a man she met, Bill becomes obsessed with having a sexual encounter. He discovers an underground sexual group and attends one of their meetings -- and quickly discovers that he is in over his head.",0.0,0.0,0.0,0.0,0.0,0.0,1.0,0.0,1.0,0.0,0.0,1.0,0.0,0.0,0.0,0.0,0.0,0.0,0.0
Seven Samurai,['Japanese'],['Japan'],8.5,1954-04-26,207,"A samurai answers a village's request for protection after he falls on hard times. The town needs protection from bandits, so the samurai gathers six others to help him teach the people how to defend themselves, and the villagers provide the soldiers with food.",0.0,1.0,0.0,0.0,0.0,0.0,1.0,0.0,0.0,0.0,0.0,0.0,0.0,0.0,0.0,0.0,0.0,0.0,0.0
People on Sunday,['No Language'],['Germany'],7.3,1930-02-04,74,"A semi-documentary experimental 1930 German silent film created by amateurs with a small budget. With authentic scenes of the metropolis city of Berlin, it's the first film from the later famous screenwriters/directors Billy Wilder and Fred Zinnemann.",0.0,0.0,0.0,0.0,0.0,0.0,1.0,0.0,0.0,0.0,0.0,0.0,0.0,0.0,0.0,0.0,0.0,0.0,0.0
